<?xml version="1.0" encoding="UTF-8"?>

<adatbazis
	xmlns:xsi="http://www.w3.org/2001/XMLSchema-instance"
	xsi:schemaLocation="C:\Users\Pirella\eclipse-workspace\DOMParseBQCMAU\src\hu\domparse\bqcmau\XMLSchemaBQCMAU.xsd">
	<telep id="01">
		<cim>
			<irSzam>3535</irSzam>
			<telepules>Budapest</telepules>
			<utca>Kutya</utca>
		</cim>
	</telep>
	<gazda id="001">
		<nev>Péter</nev>
		<fizetes>1000</fizetes>
		<kor>32</kor>
	</gazda>

	<gazda id="002">
		<nev>István</nev>
		<fizetes>2000</fizetes>
		<kor>35</kor>
	</gazda>

	<kezeltAllat id="1000">
		<betegseg>Megfázás</betegseg>
		<allatNev>Sertés</allatNev>
		<eloallitottTermek>Hús</eloallitottTermek>
	</kezeltAllat>

	<kezeltAllat id="1001">
		<betegseg>TBC</betegseg>
		<allatNev>Marha</allatNev>
		<eloallitottTermek>Hús</eloallitottTermek>
	</kezeltAllat>

	<alkalmGyogyszer id="901">
		<mennyiseg>1</mennyiseg>
		<ar>12000</ar>
		<megnevezes>Origo</megnevezes>
	</alkalmGyogyszer>

	<alkalmGyogyszer id="902">
		<mennyiseg>2</mennyiseg>
		<ar>35000</ar>
		<megnevezes>Sentor</megnevezes>
	</alkalmGyogyszer>

	<alkalmazas kezeltAllatId="1000" gyogyszerId="901">
		<alkalmazasModja>injekció</alkalmazasModja>
	</alkalmazas>

	<alkalmazas kezeltAllatId="1001" gyogyszerId="902">
		<alkalmazasModja>tabletta</alkalmazasModja>
	</alkalmazas>
</adatbazis>